{
  "$schema": "https://json-schema.org/draft/2020-12/schema",
  "title": "Axis form",
  "type": "object",
  "additionalProperties": false,
  "required": ["id", "kind", "name", "formatVersion", "entity", "sections"],
  "properties": {
    "id": { "$ref": "#/$defs/id" },
    "kind": { "const": "form" },
    "name": { "$ref": "#/$defs/name" },
    "formatVersion": { "const": 1 },
    "entity": { "$ref": "#/$defs/entityName", "x-axis-reference": "entity" },
    "sections": {
      "type": "array",
      "minItems": 1,
      "items": { "$ref": "#/$defs/section" }
    },
    "steps": {
      "type": "array",
      "minItems": 1,
      "items": { "$ref": "#/$defs/step" }
    }
  },
  "$defs": {
    "id": {
      "type": "string",
      "format": "uuid",
      "pattern": "^[0-9a-fA-F]{8}-[0-9a-fA-F]{4}-[0-9a-fA-F]{4}-[0-9a-fA-F]{4}-[0-9a-fA-F]{12}$"
    },
    "entityName": {
      "type": "string",
      "pattern": "^([A-Za-z][A-Za-z0-9]*|[a-z][a-z0-9-]*/[A-Za-z][A-Za-z0-9]*)$"
    },
    "name": {
      "type": "string",
      "pattern": "^[A-Za-z][A-Za-z0-9]*$",
      "maxLength": 60
    },
    "textReference": {
      "type": "object",
      "additionalProperties": false,
      "required": ["textKey"],
      "properties": {
        "textKey": { "type": "string", "minLength": 1, "x-axis-reference": "text" }
      }
    },
    "condition": { "type": "string", "minLength": 1, "x-axis-expression": true },
    "step": {
      "type": "object",
      "additionalProperties": false,
      "required": ["title", "sections"],
      "properties": {
        "title": { "$ref": "#/$defs/textReference" },
        "sections": {
          "type": "array",
          "minItems": 1,
          "items": { "$ref": "#/$defs/name" }
        }
      }
    },
    "section": {
      "type": "object",
      "additionalProperties": false,
      "required": ["title", "fields"],
      "properties": {
        "name": { "$ref": "#/$defs/name" },
        "title": { "$ref": "#/$defs/textReference" },
        "visibleWhen": { "$ref": "#/$defs/condition" },
        "fields": {
          "type": "array",
          "minItems": 1,
          "items": { "$ref": "#/$defs/field" }
        }
      }
    },
    "field": {
      "type": "object",
      "additionalProperties": false,
      "required": ["field"],
      "properties": {
        "field": { "$ref": "#/$defs/name", "x-axis-reference": { "part": "field", "of": "/entity" } },
        "readOnly": { "type": "boolean" },
        "visibleWhen": { "$ref": "#/$defs/condition" },
        "requiredWhen": { "$ref": "#/$defs/condition" },
        "readOnlyWhen": { "$ref": "#/$defs/condition" }
      }
    }
  }
}
