{
  "id": "e9311296-cc52-47fd-ac30-01d9051fab1d",
  "kind": "form",
  "name": "TicketResolution",
  "formatVersion": 1,
  "entity": "Ticket",
  "sections": [
    {
      "title": {
        "textKey": "ticket.sections.ticket"
      },
      "fields": [
        {
          "field": "number",
          "readOnly": true
        },
        {
          "field": "title",
          "readOnly": true
        },
        {
          "field": "description",
          "readOnly": true
        },
        {
          "field": "category",
          "readOnly": true
        },
        {
          "field": "priority",
          "readOnly": true
        },
        {
          "field": "requester",
          "readOnly": true
        },
        {
          "field": "assignedAgent",
          "readOnly": true
        },
        {
          "field": "status",
          "readOnly": true
        }
      ]
    },
    {
      "title": {
        "textKey": "ticket.sections.resolution"
      },
      "fields": [
        {
          "field": "resolution"
        }
      ]
    }
  ]
}
